{"authority":"AUTHORED_INPUT_ONLY","corpus_base_sha":"be95d8a47e241458f5e6670d79d3932e4107b011","corpus_repository":"seanchatmangpt/ggen-legacy","direct_actuation":false,"expected_repository_count":19,"final_admission_allowed":false,"head_binding":"EXTERNAL_PR_HEAD","observation_day":"2026-07-31","program_id":"EOD-RECONSTITUTE-2026-07-31","reconstitution_law":["exact Git objects outrank PR narration","merged consequence and candidate head are distinct objects","closed-unmerged candidate is preserved rather than inferred absent","transport-only repositories never become product authority","generated foundry projections are never hand-edited","full repository validation remains repository-owned","no ALIVE standing without exact-head execution receipt and replay"],"repositories":[{"canonical_reconstruction_sha":"3b0fc364f586ad0155a937f756238e7bacd94e16","default_branch":"main","depends_on":[],"product_reconstitution":true,"reconstruction_strategy":"LAYERED_EXACT_REFS","repository":"seanchatmangpt/ggen","role":"REPOSITORY_MANUFACTURING_KERNEL","sources":[{"disposition":"INTEGRATED_BRANCH","id":"ggen-foundry-plan","kind":"HEAD_COMMIT","merged":true,"observed_standing":"PARTIAL_ALIVE","pr_state":"closed","pull_request":543,"scope":"Enterprise Architecture Foundry work program","sha":"999db36647feeb2dfd0bd2250d2db2ef00b887c4"},{"disposition":"INTEGRATED_BRANCH","id":"ggen-foundry-runtime","kind":"MERGE_COMMIT","merged":true,"observed_standing":"PARTIAL_ALIVE","pr_state":"closed","pull_request":544,"scope":"Rust architecture reconstitution runtime","sha":"820bab0cfde4e4f26824f2eb706b5ec81835e6a5"},{"disposition":"INTEGRATED","id":"ggen-daily-synthesis","kind":"MERGE_COMMIT","merged":true,"observed_standing":"PARTIAL_ALIVE","pr_state":"closed","pull_request":545,"scope":"Deterministic same-day cross-repository synthesis","sha":"3b0fc364f586ad0155a937f756238e7bacd94e16"}],"validation_commands":["just fmt-check","just check","just test-lib","just guard-process-intelligence-boundary","just guard-pack-proofs","python3 tools/eod-repo-synthesis/verify.py --root . --evidence-dir target/eod-repo-synthesis"]},{"canonical_reconstruction_sha":"be95d8a47e241458f5e6670d79d3932e4107b011","default_branch":"main","depends_on":["seanchatmangpt/ggen"],"product_reconstitution":true,"reconstruction_strategy":"EXTERNAL_HEAD_BOUND_CORPUS","repository":"seanchatmangpt/ggen-legacy","role":"ENTERPRISE_ARCHITECTURE_FOUNDRY_CORPUS","sources":[{"disposition":"ACTIVE_CANDIDATE","id":"ggen-legacy-foundry-exec-base","kind":"HEAD_COMMIT","merged":false,"observed_standing":"PARTIAL_ALIVE","pr_state":"open","pull_request":4,"scope":"A-K execution branch and lawful receiving corpus","sha":"be95d8a47e241458f5e6670d79d3932e4107b011"}],"validation_commands":["cargo run --manifest-path ../ggen/tools/architecture-foundry/Cargo.toml -- validate-program --program ../ggen/docs/architecture-foundry/work-program.yaml","cargo run --manifest-path ../ggen/tools/architecture-foundry/Cargo.toml -- verify --corpus .","cargo run --manifest-path ../ggen/tools/architecture-foundry/Cargo.toml -- replay --corpus .","python3 verifiers/verify_ecosystem_reconstitution.py verify --manifest authority/ecosystem-reconstitution/2026-07-31.repositories.json --output target/ecosystem-reconstitution"]},{"canonical_reconstruction_sha":"546d0c14b58b99dbb0cddaa14394ac67266bf699","default_branch":"main","depends_on":["seanchatmangpt/ggen"],"product_reconstitution":true,"reconstruction_strategy":"INTEGRATED_WITH_PRESERVED_CANDIDATE","repository":"seanchatmangpt/wasm4pm","role":"PROCESS_EVIDENCE_AND_MINING_ENGINE","sources":[{"disposition":"INTEGRATED","id":"wasm4pm-cmd-crown","kind":"MERGE_COMMIT","merged":true,"observed_standing":"UNKNOWN","pr_state":"closed","pull_request":522,"scope":"G0-G10 combinatorial-maximalism crown","sha":"00550681d4ca7aa21bd0913f3497065534480dbe"},{"disposition":"INTEGRATED","id":"wasm4pm-open-ontology-head-verifier","kind":"MERGE_COMMIT","merged":true,"observed_standing":"PARTIAL_ALIVE","pr_state":"closed","pull_request":526,"scope":"Exact Open Ontologies dependency-head verifier","sha":"546d0c14b58b99dbb0cddaa14394ac67266bf699"},{"disposition":"ACTIVE_CANDIDATE","id":"wasm4pm-windows-portability","kind":"HEAD_COMMIT","merged":false,"observed_standing":"PARTIAL_ALIVE","pr_state":"open","pull_request":524,"scope":"Windows-representable tracked dependency tree","sha":"6053cc144d5784e1b3cf7963a4afeae9af360bca"}],"validation_commands":["cargo fmt --all -- --check","cargo check --workspace --all-targets --locked","cargo clippy --workspace --all-targets --locked -- -D warnings","cargo test --workspace --all-targets --locked","python3 scripts/cmd_g0.py crown --base HEAD","python3 scripts/cmd_g1_g10.py verify --through G10"]},{"canonical_reconstruction_sha":"c29d807f14e01236fed28afbb760ad5c1dadf08a","default_branch":"main","depends_on":["seanchatmangpt/ggen","seanchatmangpt/wasm4pm"],"product_reconstitution":true,"reconstruction_strategy":"ACTIVE_CANDIDATE","repository":"seanchatmangpt/wasm4pm-compat","role":"STRUCTURE_ONLY_COMPATIBILITY_BOUNDARY","sources":[{"disposition":"ACTIVE_CANDIDATE","id":"wasm4pm-compat-ggen-convergence","kind":"HEAD_COMMIT","merged":false,"observed_standing":"PARTIAL_ALIVE","pr_state":"open","pull_request":10,"scope":"Current ggen consumer and receipt contract","sha":"c29d807f14e01236fed28afbb760ad5c1dadf08a"}],"validation_commands":["python3 scripts/audit-ggen-usage.py --output target/ggen-standing/usage-audit.json","ggen graph validate","ggen doctor run","ggen sync run --dry-run","ggen sync run","ggen receipt verify","bash scripts/verify-ggen-contract.sh","cargo test --workspace --all-targets"]},{"canonical_reconstruction_sha":"d28af2009c8b5bcd033fe840a89863b96505d204","default_branch":"main","depends_on":["seanchatmangpt/ggen","seanchatmangpt/wasm4pm"],"product_reconstitution":true,"reconstruction_strategy":"INTEGRATED_WITH_PRESERVED_CANDIDATE","repository":"seanchatmangpt/mfw","role":"PLANNING_AND_BROKERED_WORKFLOW_ENGINE","sources":[{"disposition":"INTEGRATED","id":"mfw-gmrw-checkpoints","kind":"MERGE_COMMIT","merged":true,"observed_standing":"PARTIAL_ALIVE","pr_state":"closed","pull_request":47,"scope":"GMRW and ten receipted Gall checkpoints","sha":"d28af2009c8b5bcd033fe840a89863b96505d204"},{"disposition":"PRESERVED_CANDIDATE","id":"mfw-safe-planner-fond","kind":"HEAD_COMMIT","merged":false,"observed_standing":"ALIVE","pr_state":"closed","pull_request":49,"scope":"Dependency-closed FOND policy candidate generation and replay","sha":"8ee36c07540e2d54f0adf35717b9fad5ff7c46e6"}],"validation_commands":["cargo fmt --manifest-path mfw-pcp-core/Cargo.toml --all -- --check","cargo clippy --manifest-path mfw-pcp-core/Cargo.toml --all-targets -- -D warnings","cargo test --manifest-path mfw-pcp-core/Cargo.toml --all-targets","cargo fmt --manifest-path mfw-planner/Cargo.toml --all -- --check","cargo clippy --manifest-path mfw-planner/Cargo.toml --all-targets -- -D warnings","cargo test --manifest-path mfw-planner/Cargo.toml --all-targets"]},{"canonical_reconstruction_sha":"1a0cdba8c33ebef3c29e203c5879cd7b6416d4a1","default_branch":"main","depends_on":["seanchatmangpt/ggen"],"product_reconstitution":true,"reconstruction_strategy":"LAYERED_MERGED_CONSEQUENCES","repository":"seanchatmangpt/ferroplan","role":"DETERMINISTIC_AND_PROBABILISTIC_PLANNING_ENGINE","sources":[{"disposition":"INTEGRATED_BRANCH","id":"ferroplan-full-planning","kind":"MERGE_COMMIT","merged":true,"observed_standing":"PARTIAL_ALIVE","pr_state":"closed","pull_request":25,"scope":"Full planning under uncertainty and ggen projections","sha":"18dbc73d00eccca0c4c3fa087cb7a1fc1eb1b5f2"},{"disposition":"INTEGRATED","id":"ferroplan-auto-admission","kind":"MERGE_COMMIT","merged":true,"observed_standing":"PARTIAL_ALIVE","pr_state":"closed","pull_request":26,"scope":"Ledger isolation and bounded auto-admission","sha":"52fcc328f840159be09c143516323b7f751c9263"},{"disposition":"INTEGRATED","id":"ferroplan-daily-methods","kind":"MERGE_COMMIT","merged":true,"observed_standing":"ALIVE","pr_state":"closed","pull_request":27,"scope":"Daily agent PPDDL operating-method corpus","sha":"1a0cdba8c33ebef3c29e203c5879cd7b6416d4a1"}],"validation_commands":["cargo fmt --all -- --check","cargo clippy --workspace --exclude ferroplan-bevy --all-targets --all-features -- -D warnings","cargo test --workspace --exclude ferroplan-bevy","cargo bench --no-run -p ferroplan","ggen sync run","ggen receipt verify"]},{"canonical_reconstruction_sha":"4db159cea2db6ea2f823678f347e0719bf30e18a","default_branch":"main","depends_on":[],"product_reconstitution":true,"reconstruction_strategy":"ACTIVE_CANDIDATE","repository":"seanchatmangpt/unrdf","role":"RDF_JAVASCRIPT_WORKSPACE","sources":[{"disposition":"ACTIVE_CANDIDATE","id":"unrdf-package-execution","kind":"HEAD_COMMIT","merged":false,"observed_standing":"UNKNOWN","pr_state":"open","pull_request":98,"scope":"Executable package matrix and repository repairs","sha":"4db159cea2db6ea2f823678f347e0719bf30e18a"}],"validation_commands":["pnpm install --frozen-lockfile","pnpm -r build","pnpm -r test","pnpm -r lint","pnpm -r typecheck"]},{"canonical_reconstruction_sha":"a392e009400c83d5e175b508c4e3008e189945d3","default_branch":"main","depends_on":["seanchatmangpt/ggen","seanchatmangpt/unrdf"],"product_reconstitution":true,"reconstruction_strategy":"MERGED_CONSEQUENCE","repository":"seanchatmangpt/ostar","role":"ONTOLOGY_AND_AGENT_FRAMEWORK_RUNTIME","sources":[{"disposition":"INTEGRATED","id":"ostar-ggen-migration","kind":"MERGE_COMMIT","merged":true,"observed_standing":"PARTIAL_ALIVE","pr_state":"closed","pull_request":11,"scope":"Twenty one-to-one ggen projection migrations","sha":"a392e009400c83d5e175b508c4e3008e189945d3"}],"validation_commands":["python3 scripts/verify_ggen_contract.py","python3 scripts/verify_ggen_boundaries.py","ggen sync run","ggen receipt verify","python3 scripts/verify_ggen_outputs.py","uv run pytest"]},{"canonical_reconstruction_sha":"b683ba992f6de877b97